,date,jobsource,jobsearch,MetroID,jobtitlenorm,jobeasyapply,jobisorganic,companyname,jobdaysago,companysize,companyfounded,companytype,companyindustry,companysector,companyrevenue,companyrating,companyratings,companyrecommendfriend,companyapproveceo,jobtitle,cityname,jobdescription,wageavg,wagemin,wagemax
0,2022-01-24,glassdoor,data analyst,1.0,,,,,,501 to 1000 Employees,Subsidiary or Business Segment,Health Care Services & Hospitals,Health Care,Unknown / Non-Applicable,,3.5,11 Ratings,71 %,85 %,Encounter Data Analyst,"Lake Success, NY","General Purpose/Scope:
The Encounter Data Analyst evaluates encounter data and identifies errors created by operational, claims, and eligibility processes. This position will research, analyze, summarize, and categorize all types of encounters based on response files from NYSDOH and CMS, as appropriate. This position will also work closely with other internal departments, delegated vendors, and government agencies to monitor and communicate that the paid and denied claims adjudicated are accurately submitted and processed to the NYSDOH and CMS, as appropriate. These claims, called ‘encounter data,’ are submitted along with member and provider files from the plans, and are critical data inputs used to inform program total cost of care, quality, and utilization – which are ultimately used to inform risk sharing and other incentive-based payments from the NYSDOH to the ACOs and MCOs.
The Encounter Data Analyst will need to understand the overall data, process flows, and provider data specifications used within the NYSDOH, and work with the Data Warehouse and Analytics teams to create targeted and ongoing reports to track data accuracy and timeliness; and support ACO and MCO management teams in working collaboratively with partners to improve overall encounter, member, and provider data quality.
Responsibilities Include:
Retrieves, compiles, reviews, and ensures the accuracy of encounter data from Integra systems and delegated vendor sources, using an 837-file format.
Will need to be able to access data from the Integra Data Warehouse using a variety of tools such as MS Access and SAS Enterprise Guide.
Summarizes large volumes of encounter data in analytical reports that include tables, graphs, qualitative and quantitative analyses for management review and use.
Reviews and ensures the accuracy of reports and corrects discrepancies.
Works closely with IT to ensure data completeness, data accuracy, and data availability.
Assists in the development of reports and projects, including documenting methodology, protocols, analysis, and design.
Programs using SAS, SQL or other appropriate software to generate reports based on input/direction from management and other report users.
Collaborates with other departments and vendors to identify missing data, errors or other anomalies; works with them to correct these encounter data errors, gather necessary information and provide guidance on regulatory reporting needs.
Initiates and maintains internal contacts to secure current/correct encounter data necessary for clear presentations of all reports, special projects, etc.
Assists in the development of analysis plans, which includes documenting analyses methodology, protocols, and design.
Researches, recommends and implements efficient means of data collection, maintenance, and analysis.
Reviews and identifies trends and variances in encounter data and reporting.
Researches findings and determines the appropriateness of elevating identified issues to leadership for further review/evaluation/action
Performs special projects and other duties, as needed.
Qualifications:
Bachelor's Degree in Computer Science, Public Health, Healthcare Informatics, Health Administration, Statistics, or other relevant discipline required
Minimum 2 years of increasingly responsible data analysis/reporting experience in a healthcare setting
Minimum of 1 year performing encounter data analysis of APD, EDPS, and/or RAPs in a health care or health plan organization
Skills/Abilities
Knowledge of encounter data processes, files, etc
Computer proficiency in Outlook, Word, PowerPoint. Advanced proficiency in personal computer programs, including MS Excel (including formulas, sorts, filters, pivot tables, IF statements, VLOOKUP, HLOOKUP, etc), MS Access (criteria statements, table links, and database and report creation)
Experience working within a data warehouse environment
Strong detail orientation and organizational skills
Effective oral, written, and interpersonal communication skills required
Knowledge of MLTC and Medicare Advantage encounter data analytics preferred
Knowledge of SAS Enterprise Guide, SAS Base programming required
Integra is an Equal Opportunity Employer and prohibits discrimination or harassment based on any characteristics protected by the laws or regulations in the locations where we operate.
IND123","$54,152 /yr (est.)",$39K ,$75K
1,2022-01-24,glassdoor,data analyst,1.0,Data Analyst,false,false,Doximity,30d+,201 to 500 Employees,2010,Company - Public,Enterprise Software & Network Solutions,Information Technology,Unknown / Non-Applicable,4.8,30 Ratings,96 %,93 %,Data Analyst,New York State,"Doximity is transforming the healthcare industry. Our mission is to help doctors be more productive, informed, and connected. As a Data Analyst, you'll work within cross-functional delivery teams alongside other analysts, engineers, and product managers in discovering data insights to help improve healthcare.
Our team brings a diverse set of technical and cultural backgrounds and we like to think pragmatically in choosing the tools most appropriate for the job at hand.
This role can be filled in our San Francisco headquarters OR remotely in the U.S.
About Us
Here are some of the ways we bring value to doctors
Here is an introduction to our tech stack
We use UNIX command-line interface and standard programming tools (vim/emacs, git, etc.) and have over 350 private repositories in Github containing our applications, forks of gems, our own internal gems, and open-source projects
We have worked as a distributed team for a long time; we're currently about 65% distributed
Find out more information on the Doximity engineering blog
Our company core values
Our recruiting process
Our product development cycle
Our on-boarding & mentorship process
Here's How You Will Make an Impact
Leverage Doximity's extensive datasets to identify and classify behavioral patterns of medical professionals on our platform.
Play a key role in creating both product and client-facing analytics.
Inform data team strategy by working with the product leaders and managers. Actively participate in execution and some planning of organizational data team strategy.
Collaborate with a team of product managers, analysts, and other developers to define and lead data projects from data ingestion to analysis to recommendations.
About you
At least 2 years of professional experience as a data analyst or a data scientist.
Knowledge of statistical concepts, especially exploratory data analysis techniques, and probability theory.
Excellent SQL skills to create and evaluate complex statements involving numerous tables and data relationships.
Excellent visualization and storytelling skills to explain your results and solutions to the stakeholders, clearly and compellingly.
Proficient in using Python data analysis libraries such as Pandas and Numpy. Also has a basic understanding of the object-oriented programming concepts as it relates to Python.
Prior exposure to distributed data processing concepts and execution (e.g., working with column stores, leveraging spark, etc.)
Fast learner; curiosity about and passion for data.
Benefits
Doximity has industry-leading benefits. For an updated list, see our career page
More info on Doximity
We're thrilled to be named the Fastest Growing Company in the Bay Area, and one of Fast Company's Most Innovative Companies. Joining Doximity means being part of an incredibly talented and humble team. We work on amazing products that over 80% of US doctors (and over one million healthcare professionals) use to make their busy lives a little easier. We're driven by the goal of improving inefficiencies in our $3.5 trillion U.S. healthcare system and love creating technology that has a real, meaningful impact on people's lives. To learn more about our team, culture, and users, check out our careers page, company blog, and engineering blog. We're growing steadily, and there's plenty of opportunities for you to make an impact.
Doximity is proud to be an equal opportunity employer and committed to providing employment opportunities regardless of race, religious creed, color, national origin, ancestry, physical disability, mental disability, medical condition, genetic information, marital status, sex, gender, gender identity, gender expression, pregnancy, childbirth and breastfeeding, age, sexual orientation, military or veteran status, or any other protected classification. We also consider qualified applicants with criminal histories, consistent with applicable federal, state, and local law.","Size
201 to 500 Employees
Founded
2010
Type
Company - Public
Industry
Enterprise Software & Network Solutions
Sector
Information Technology
Revenue
Unknown / Non-Applicable",,
2,2022-01-24,glassdoor,data analyst,1.0,Senior Business Analyst,false,false,NYC Careers,30d+,1 to 50 Employees,Nonprofit Organization,Education Training Services,Education,Unknown / Non-Applicable,,,0 Ratings,100 %,N/A,SENIOR BUSINESS ANALYST,"New York, NY","The Financial Information Services Agency and the Office of Payroll Administration (FISA-OPA) has a vacancy for a Sr. Business Analyst to support the Financial Management System (FMS). The primary responsibilities of the position are:

Investigate software issues reported by the Level 1 and 2 end user support or escalated to the FISA Business Teams by our Oversight Agencies. Follow through on reported issues may include some or all of the following actions below:

°Proposing and authoring refinements to policy and procedure documentations,
° Proposing and authoring refinements to training material,
° Escalating to the development team the need for a programmatic resolution,
° Proposing end user (or oversight) workarounds to the usage issues (when appropriate), (for complex usage scenarios) providing education and and/or guidance when the system is not being used as designed/intended
° Escalating to the Business team management, the need for correction/enhancement to the software.
° Informing the Level 1 and 2 end user support teams of the resolution and communicating to those teams any instructions that need to be relayed to the individual who reported the issue.
Analyze and document business requirements and the related non-functional requirements of the solution (e.g. operational, security, timing, etc.) as prioritized by the FISA Entity Manager. Solutions are provided that implement new and change existing components of the Financial System - in the form of: new reports, enhancements to existing reports, data fixes, mass data changes (as a substitute for large scale data entry), new batch processes and enhancements to batch processes, simple and advanced data configuration bundles, definition of new online transactions and inquiries, changes to existing online transactions and inquiries, etc.
Author functional design documents that capture the details of the solution in all aspects (e.g. workflow requirements, business validations to be performed on data entry forms, formulas to be applied in calculations on inquiries and reports, presentation layer requirements on inquiries and reports, definition of inputs/outputs and business logic of new/modified batch processes, configuration profile, application data configuration changes required to enact the business or processing change, etc.) The documentation produced will follow FISA's standard for functional designs.
Work with technical analysts to research problems and find and implement solutions as assigned by the FISA Entity Manager.
During periods of peak testing (e.g. major releases) or as directed by the FISA Entity Manager, the candidate will test software to ensure it meets specifications and identify any defects. This task is done by using the on line application, performing data analysis through the use of a reporting tool, and in certain scenarios, through the execution of batch scripts, the candidate will also be expected to review and expand on business scenarios for the System Test team to test program modifications made to functional processes and Business Events programs.
The candidate will be expected to take primary testing, coordination and scheduling (i.e. management) responsibilities for business data fix and mass data changes.
Support and execute functional business events. This task is done using the on line application, performing data analysis through the use of a reporting tool, and in certain scenarios, through the execution of batch scripts.
Run simulations of business event processing and provide detailed status reporting on progress, detailed inventory of defects identified and in the scope of regression testing for the event, very detailed reporting on transactional failures once the event has been simulated.
Manage business event execution in production, which entails: assignment of tasks to participating parties, collection of status of assigned tasks, execution of tasks assigned to the candidate (e.g. reconciliation via data queries, plotting of numbers from executed reports onto reconciliation worksheets, review of transaction processing success rates, escalation of transaction rejections to individuals assigned for data correction or end users), dissemination of post event processing results (in terms of document counts, dollar value, and qualitative analysis of document processing results). Business events are generally executed during times when the system is offline for batch processing or maintenance. The candidate is expected to be able to provide evening or weekend support for business event execution.
Attend scheduled meetings where RM's (change control tracking items) are reviewed with the individuals from the development organization(s) supporting the Financial Management System. The candidate will have an assigned portfolio of RM's assigned and is expected to be prepared to speak to the business need in production date, requirements of the fix requested of the development organization, status of testing (if the candidate is performing user acceptance testing on behalf of the end users.
Update assigned RM's in a timely and complete manner such that the development organizations and release management staff are able to assess the assign, estimate and schedule the ticket/work item effectively.
Provide written status reports and timelines for the project management office when work tracks have graduated to the level of a project and require centralized reporting. The candidate may be expected to speak the status of 'mini-projects' in the management meetings as necessary.
Perform independent research and document findings on topics pertinent to the business of the Financial Systems division - as requested by the FISA Entity Manager.

With a wide degree of latitude for independent judgment, the Sr. Business Analyst is expected to perform the above activities for simple, medium and complex business problems.
Minimum Qual Requirements
1. A baccalaureate degree from an accredited college in computer science, information systems, engineering, mathematics or related field and six years of satisfactory full-time experience related to enterprise architecture, solutions architecture, network architecture and/or IT infrastructure systems; or

2. A baccalaureate degree from an accredited college and ten years of satisfactory full-time experience related to enterprise architecture, solutions architecture, network architecture and/or IT infrastructure systems; or

3. Education and/or experience which is equivalent to ""1"" or ""2"" above.
Preferred Skills
Excellent oral and written communication skills
Proven analytical and problem solving skills
Ability to work independently with minimal direction and under pressure with tight deadlines
Hands-on proven experience balancing and reconciling financial data
Demonstrated proficiency with MS Access; MS excel; and other Microsoft tools such as Word, PowerPoint and Visio
Knowledge of and experience with TSO and JCL or submitting korn shell scripts (preferred but not required)
Ability to speak in front of a user group and dearly describe how business functions are executed from within the FISA Financial System software and exception process/usage scenarios
Ability to orchestrate an end user meeting with the goal of gathering requirements, gaining consensus between parties on business issues, taking and publishing meeting minutes, presenting deliverables developed by the candidate for review.
Knowledge of some or all of the following is required: FMS Contract Software, FMS2 Budget, FMS3 Accounting
Minimum 3 years hands-on experience in a business analyst position for an Enterprise Resource Planning (ERP) project working with budget and/or procurement and/or contract functionality, preferable Advantage ERP accounting system with demonstrated experience
using tools such as SQL, Crystal Reports, MS Access, and Excel.
Minimum 3 years of experience implementing a full System Development Lifecycle for an Enterprise Resource Planning (ERP) system for a large organization.
Minimum S years of experience developing test scripts and performing system/user testing for budget and/or procurement and/or contract functionality, preferable Advantage ERP system.
Additional Information
P-545

The City of New York offers a comprehensive set of benefits and programs to employees, including health insurance, pension plan, Deferred Compensation Plan (with 457, 401K and Roth IRA options), pre-tax Commuter Benefit program, pre-tax Flexible Spending Accounts programs and more. Additional benefits such as prescription drug coverage, dental benefits, vision care benefits and more are also available through District Council 37 – Local 2627, the union that represents employees in this title.
To Apply
External applicants please visit https://a127-jobs.nyc.gov/ to apply to Job ID # 509756. Current NYC employees may apply via Employee Self Service (ESS). While all complete applications will be given consideration, only candidates selected for an interview will be contacted by FISA-OPA.

FISA/OPA IS AN EQUAL OPPORTUNITY EMPLOYER.
Hours/Shift
Monday – Friday, 9am to 5pm.
Residency Requirement
New York City Residency is not required for this position.",,,
3,2022-01-24,glassdoor,data analyst,1.0,Business Analyst,true,false,BioIVT,11d,51 to 200 Employees,Company - Private,Biotech & Pharmaceuticals,Biotech & Pharmaceuticals,$5 to $10 million (USD),,2.9,17 Ratings,44 %,71 %,Business Analyst,"New York, NY","US Based, remote position, preferably located in Mid-West, Eastern US.

BioIVT, formerly BioreclamationIVT, is a leading global provider of high-quality biological specimens and value-added services. We specialize in control and disease state samples including human and animal tissues, cell products, blood, and other biofluids. Our unmatched portfolio of clinical specimens directly supports precision medicine research and the effort to improve patient outcomes by coupling comprehensive clinical data with donor samples.
Our Research Services team works collaboratively with clients to provide in vitro hepatic modeling solutions. And as the world’s premier supplier of ADME-Tox model systems, including hepatocytes and subcellular fractions, BioIVT enables scientists to better understand the pharmacokinetics and drug metabolism of newly discovered compounds and their effects on disease processes. By combining our technical expertise, exceptional customer service, and unparalleled access to biological specimens, BioIVT serves the research community as a trusted partner in ELEVATING SCIENCE®.
Job Purpose
The Business Analyst (M&A Acquisitions) will support the growth and success of acquired partner businesses by planning and executing on implementing best in class operational processes. This position provides business analysis services to internal business partners. The BA is an agent of change within the organization and our acquired partners. The focus of this position is to work closely with the business units to gain an in-depth understanding of internal customers' business strategy, processes, services, roadmap, and the context in which the business operates. These tasks will be vital in addressing business challenges and integrating newly acquired organizations into our established systems and processes.
The M&A Acquisitions Business Analyst serves as a leader on the M&A Acquisitions Integrations Team lending their experience with process mapping and design to solving complex business process alignment problems. The BA will lead the team to identify and map the business processes of newly acquired organizations and will plan for the integration/absorption/alignment of those processes with an existing business process where needed. This will include reviewing selected business processes from end to end to identify and address operational, financial, and technological needs. Identify opportunities to improve efficiency. Responsibilities will include a full range of activities, from leading projects to assisting business managers with understanding how to best integrate new organizations into our own.
Duties and Responsibilities
Lead cross-functional teams through integrated planning and execution, value creation planning, and change management
Establish partnerships with business unit and functional Integration Leads, IT product managers, and key business stakeholders help align the business operating model, integration strategy and execution, and status of projects and key decisions
Define, implement, and communicate Key Performance Indicators to showcase the value creation impact of integrations
Implement effective operational processes with a lens towards scale and repeatability
Provide analytical support for critical corporate initiatives, including business function support for system migrations and consolidations and significant business process improvement projects
Lead or participate in multiple projects by completing and updating project documentation; managing project scope; adjusting schedules when necessary; determining daily priorities and resource requirements; ensuring efficient and on-time delivery of project tasks and milestones; following proper escalation paths; and managing customer and supplier relationships.
Demonstrate a high level of subject matter expertise in functional areas to bridge business requirements and IT solutions; provide technical direction and ensure adoption of best-practice solutions.
Document current and future state processes.
Manage internal customer relationships and expectations by developing a communication process to keep others up-to-date on project results
Create and maintain issue logs, meeting minutes, meeting schedules, project summaries, and updates as required to promote proactive and effective communication
Qualifications
Bachelor's degree in the field of computer science, information systems, business, or a related field
The ideal candidate is action-oriented, impact-focused, and has an operational background with exposure to other business functional teams (finance, HR, Marketing/Commercial, etc)
Prior experience or a curiosity to learn about M&A and the integration of recently acquired teams into new and existing organizational systems and processes - while minimizing disruption and optimizing value creation
Experience in a business analytics role: including requirements gathering, process definition, business process documentation.
Experience working with ERP or other major systems implementation projects is a plus
Demonstrated ability to work successfully on large projects
Problem solving skills evidenced by demonstrated results in past positions
Ability to work under tight deadlines and handle multiple/detail-oriented tasks
Data Analysis: Skilled in data reporting, data analysis, and business impact analysis
Excellent verbal (written and oral) and interpersonal communication skills.
Strong time management, ability to successfully manage multiple tasks at any given point, strong relationship building skills & communication skills.
Able to work collaboratively across the organization and at all levels
Self-motivated, self-directed, and attentive to detail.
Experience working in a team-oriented, collaborative environment.
Excellent follow-through
Ability to travel to company locations as projects require

The Company is an AA/EEO/Veterans/Disabled Employer.","$88,962 /yr (est.)",$62K ,$129K
