,date,jobsource,jobsearch,MetroID,jobtitlenorm,jobeasyapply,jobisorganic,companyname,jobdaysago,companysize,companyfounded,companytype,companyindustry,companysector,companyrevenue,companyrating,companyratings,companyrecommendfriend,companyapproveceo,jobtitle,cityname,jobdescription,wageavg,wagemin,wagemax
20,2022-01-24,glassdoor,data analyst,1.0,Senior Analyst,false,false,Michael Page,4d,5001 to 10000 Employees,1976,Company - Private,$10+ billion (USD),,,,,,,"Senior Analyst, Data Products AdTech","New York, NY","MPI does not discriminate on the basis of race, color, religion, sex, sexual orientation, gender identity or expression, national origin, age, disability, veteran status, marital status, or based on an individual's status in any group or class protected by applicable federal, state or local law. MPI encourages applications from minorities, women, the disabled, protected veterans and all other qualified applicants.

Description

Responsibilities:

Operate as supporting ad tech expert to marketing, responsible for understanding marketing's campaign initiatives and implementing the tech needed to bring them to life.
Coordinate and prioritize tagging needs of marketing and agency teams, work with internal dev teams to get tagging needs implemented.
Lead and subject matter expert on Google Marketing Platform, MMP (Kochava) and SDK implementations (including Firebase and mParticle)
Lead on product marketing implementations - i.e. deeplinking capabilities within app.
Work heavily within the CDP (mParticle) to ensure key data events are getting into the CDP, and ensuring events are being accurately forwarded to ad platforms for optimization.
Work with, and support, marketing analytics team to ensure their data collection needs are met (MTA tagging, click trackers/integrations, accurate DCO tagging, etc.)
All applicants must be authorized to work in the USA. Company will not provide visa sponsorship.
Requirements:

BA/BS in technical or marketing discipline or relevant work experience
5+ Years working within the buy side of ad tech and mar tech
Experience at ad agency a plus
Strong experience with full stack Google Marketing Platform, particularly GA and Firebase
Experience with MMP implementations and experience implanting functionality and tracking of deeplinking capabilities
Experience with owned marketing integrations with paid-media campaigns
They just started a new dynamic streaming service. This company was founded over 80 years ago and here you'll find more than a job. Here you'll find a fast-paced, determined team of unique people who want to be at the epicenter of technology, sports, news, tv, movies and more. They are determined to forge the next frontier of streaming through creativity, teamwork, and talent.
Full Time Permanent Role

Health Benefits

Bonuses

Can Be Remote!

All applicants must be authorized to work in the USA. Company will not provide visa sponsorship.",,,
21,2022-01-24,glassdoor,data analyst,1.0,Analyst,false,false,Aquent,12d,1001 to 5000 Employees,1986,Company - Private,Staffing & Outsourcing,Business Services,Unknown / Non-Applicable,4.3,206 Ratings,87 %,94 %,Analyst,"New York, NY","Location:
New York, NY
Job Terms:
Temporary
Start date:
01/03/2022
Date:
01/12/2022
Job Description:
Aquent is hiring a Analyst!
100% Remote or onsite in New York
6 mons - on going
The Analyst is responsible for the data analysis and reporting of all PBNA Creative Agency scopes of work and production costs. This role will track all agency and production costs, enter SOW details into Decideware, and be responsible for generating reports to improve PBNA’s management of these costs. This role will help streamline the SOW process and assist the Studio in training Brands, Divisions and Customer teams on the SOW process.
**Need someone that can do Analytical and reporting work (creative spend)that utilize outside agencies for creative outsourcing.**
Key Responsibilities:
Own the data for agency and production spend at PBNA; internal systems expert (Decideware, etc.)
Track all agency fees and production costs, leveraging Decideware and other systems as needed.
Generate monthly, annual and adhoc reports for use by PBNA to better understand agency and production spend.
Analyze scopes of work (SOWs) to help PBNA better understand average rates for all types of marketing-related work, including strategy, creative development, production, community management, etc.
Assist the VP in improving the SOW process to reduce administrative time/fees and increase focus on elevating creative excellence
Assist the VP in training marketing teams on the new SOW process.


Key Skills and Experience:
At least 2 years of experience working with creative agencies.
Experience with Decideware or similar platform.
Basic understanding of creative agency team roles and rates.
Basic understanding of production costs and rates.
Creative thinker and problem solver with a desire to innovate and improve existing processes
Strong communication skills
Strong client facing/interpersonal and written skills. Interacts directly with brand clients.
Impeccable attention to detail and organization
Ability to analyze data and pull out trends and other insights that might help PBNA and agency partners better manage costs.","$71,631 /yr (est.)",$51K ,$101K
22,2022-01-24,glassdoor,data analyst,1.0,Business Analyst,true,false,Robert Half,4d,10000+ Employees,1948,Company - Public,Staffing & Outsourcing,Business Services,$5 to $10 billion (USD),3.9,605 Ratings,74 %,83 %,Business Analyst,"New York, NY","Are you adept at creating action plans based on business needs and a proficient problem-solver? The Business Analyst will be responsible for the documentation, analysis, and elicitation of business and technical needs across multiple business units. To be successful in this role, you must have exceptional communication skills and a proven ability to communicate technical and business requirements alike.

Your responsibilities in this role

Documents and elicits requirements through user stories, use cases, process flow diagrams, etc.
Builds relationships and collaborates with business units, development teams, and other stakeholders to gather, analyze and prioritize requests
Ensures that complex requirements are executable, testable, complete and not ambiguous
Experience with Agile methodology
4+ years of business analysis experience
Ability to write basic to moderately complex SQL queries, as well as technical skills including Word, Excel, PowerPoint, Visio, and Jira (or similar tool)
Background working with a variety of simple to complex projects
Willing to take ownership, proactive, flexible, adaptable, strong problem-solving skills, and the ability to communicate to all levels in an organization
Bachelor's Degree in Computer Science, Management Information Systems, Business Administration or equivalent work experience
Experience eliciting and documenting requirements in a clear and concise manner
Technology Doesn't Change the World, People Do.®

Robert Half is the world’s first and largest specialized talent solutions firm that connects highly qualified job seekers to opportunities at great companies. We offer contract, temporary and permanent placement solutions for finance and accounting, technology, marketing and creative, legal, and administrative and customer support roles.

Robert Half puts you in the best position to succeed by advocating on your behalf and promoting you to employers. We provide access to top jobs, competitive compensation and benefits, and free online training. Stay on top of every opportunity – even on the go. Download the Robert Half app and get 1-tap apply, instant notifications for AI-matched jobs, and more.

Questions? Call your local office at 1.888.490.4429. All applicants applying for U.S. job openings must be legally authorized to work in the United States. Benefits are available to contract/temporary professionals. Visit https://roberthalf.gobenefits.net/ for more information.

© 2021 Robert Half. An Equal Opportunity Employer. M/F/Disability/Veterans. By clicking “Apply Now,” you’re agreeing to Robert Half’s Terms of Use .",,,
23,2022-01-24,glassdoor,data analyst,1.0,Business Analyst,false,false,Michael Page,30d+,5001 to 10000 Employees,1976,Company - Private,$10+ billion (USD),,,,,,,Business Analyst,"New York, NY","MPI does not discriminate on the basis of race, color, religion, sex, sexual orientation, gender identity or expression, national origin, age, disability, veteran status, marital status, or based on an individual's status in any group or class protected by applicable federal, state or local law. MPI encourages applications from minorities, women, the disabled, protected veterans and all other qualified applicants.

Description
Lead the identification of business requirements, working closely with Sales, Operations, Community Development, and other teams.
Document business requirements for Agile software development, producing user stories, process flows, and other analysis artifacts.
Make solution recommendations, identifying opportunities for standardization in line with corporate strategy.
Liaise with offshore technical teams.
Assist with product backlog grooming sessions, defect triangle, and participate in sprint demos.
Assist in planning and executing the migration of business operations to new platforms.
5+ years of experience as a Business Analyst.
Bachelor's Degree or equivalent.
Experience in process blueprinting/mapping and user story.
Excellent problem-solving and analytical skills.
Cross-cultural communication skills and experience working with offshore IT teams.
Our client is the retail industry's best and biggest event. Held annually in Las Vegas, it is a gathering of individuals and companies reshaping how consumers discover, shop and buy. The event provides a platform for large retailers and branded manufacturers, start-ups, tech companies, investors, media and analysts to learn, network, collaborate and evolve.
Competitive base salary, commensurate with experience.
Partial remote work.
Experience working for retail's largest industry event.","$80,954 /yr (est.)",$58K ,$113K
24,2022-01-24,glassdoor,data analyst,1.0,Business Analyst,false,false,TEKsystems,24h,1001 to 5000 Employees,1983,Subsidiary or Business Segment,Staffing & Outsourcing,Business Services,$5 to $10 billion (USD),4.0,1964 Ratings,83 %,92 %,Healthcare IT Business Analyst,"New Hyde Park, NY","Equivalent Experience
100% remote
Ideal candidate will have experience within healthcare
Must have SQL experience
Looking for candidates with 2-4 years of Business Analyst experience within healthcare
Description:
Our client is looking for an IT Business Analyst for a FULL TIME REMOTE position. Every 2 years, doctors must re-credential to maintain eligibility to practice in hospitals. This person will join a team that is responsible for implementing a brand new credentialing/licensing application.
Analyzes, verifies, tracks and recommends for Project, Product and Solution implementation and maintenance. Liaises between various agile teams and project teams. Recommends and delivers product and solution plans and training materials throughout implementation and helps ensure smooth operations post implementation.
Job Responsibility
Analyzes, verifies, tracks and recommends for development of implementation plans for system development and implementation of products and solutions which may include discovery, design, conversion, testing, and/or any other components of the project plan cycle and agile delivery.
Serves as a liaison between business and technology teams.
Participates in developing and delivering training programs for current and prospective users; educates practice, site, and corporate management on project operations and procedures.
Assists implementation team in configuring HIPAA rules based on System policies and legal requirements.
Ensures processes are compliant with system policies, applicable laws, and contractual bargaining agreements.
Performs solution audits; resolves discrepancies, as required.
Collaborates with implementation teams to resolve user issues.
Consults with departments to provide customer support during and post implementation.
Conducts post implementation satisfaction surveys; advises management of results and recommends actions; troubleshoots issues and resolves concerns as well as recommends necessary fixes; consults with newly acquired facilities and designs transition and implementation plans.
Operates under general guidance and work assignments are varied and require interpretation and independent decisions on course of action.
Performs related duties as required. All responsibilities noted here are considered essential functions of the job under the Americans with Disabilities Act.
Job Qualification
At least 3 years of experience as an IT Business Analyst within an enterprise environment.
Experience gathering requirements, improving business processes, testing products and providing support to end users.
Experience writing SQL queries. Healthcare credentialing and/or licensing experience would be a huge plus.
Bachelor’s Degree required, or equivalent combination of education and related experience.
Minimum of 3 years of relevant experience, required. Experience working in a dynamic, high-technology environment, preferred.
Excellent communication, interpersonal & leadership skills, preferred.
Skills:
Business analysis, Requirement gathering, Health care, Sql, Process improvement, healthcare credentialing, healthcare, healthcare licensing
Top Skills Details:
Business analysis, Requirement gathering, Health care, Sql, Process improvement
Additional Skills & Qualifications:
Healthcare credentialing and/or licensing experience would be a huge plus. Someone with prior healthcare experience in general is preferred.
Experience Level:
Intermediate Level
About TEKsystems:
We're partners in transformation. We help clients activate ideas and solutions to take advantage of a new world of opportunity. We are a team of 80,000 strong, working with over 6,000 clients, including 80% of the Fortune 500, across North America, Europe and Asia. As an industry leader in Full-Stack Technology Services, Talent Services, and real-world application, we work with progressive leaders to drive change. That's the power of true partnership. TEKsystems is an Allegis Group company.
The company is an equal opportunity employer and will consider all applications without regards to race, sex, age, color, religion, national origin, veteran status, disability, sexual orientation, gender identity, genetic information or any characteristic protected by law.","$71,724 /yr (est.)",$50K ,$103K
25,2022-01-24,glassdoor,data analyst,1.0,Business Analyst III,true,false,Aston Carter,12d,1001 to 5000 Employees,1997,Company - Private,Staffing & Outsourcing,Business Services,Unknown / Non-Applicable,4.4,112 Ratings,89 %,95 %,Business Analyst III (Non-IT),"New York, NY","Equivalent Experience

Business Analyst III (Non-IT)
If you are ready to explore the next step in your career promising a healthy work/life balance, advancement opportunities, and career stability
the Business Analyst opportunity below is worth exploring.

The top accounting and finance professionals continue choosing this leading financial institution to expand career goals as this team builds a strong reputation at one of America’s top banks. Demonstrated with accolades like the “ 2020 Model Bank Award ” and commitment to $20MM in educational funding in the coming years, this department has grown into the gold standard for asset management firms in the NY Metro.

What you’ll enjoy…
“Best Place to Work” – Voted 2021 “ Best Places to Work ” by employees and clientele around the country
Luxury Offices – Personal desk in-office + walking distance from the waterfront and top local eateries
Immediate Start – Top applicants will undergo a one round interview with the management team and an offer within 48-hours
Lucrative Salary – The most qualified applicants with relevant experience can earn up to $84/hour (Negotiable)
Interview Insights – Study interview questions before meeting, discuss Resume advice, and receive post-interview feedback
Ample Resources – Access one of the most robust databases and tech stack to run your team efficiently
Comprehensive Benefits – Comprehensive benefits + Stock options (Just increased dividend yields!)
Awarded Employer – You will join the team that’ve earned accolades like “ World’s Most Admired Companies ”

A day in the role…
Serve as the liaison between internal and external stakeholders to ensure the delivery of project change on time, within budget, and to business and technical requirements.
Manages projects at a detailed level (plans, work break down structures, scheduling, and dependency management). Holds regular status meetings and/or daily stand-ups to facilitate delivery and issue resolution.
Ensure that end users are trained users on new or enhanced applications and/or systems of higher complexity, including all operationalization tasks that are required to ensure successful delivery.
Necessary Skills and Strengths:
Market and Credit Risk | SQL Reporting | Agile PM | Program Risk Management | Regulatory Reporting | Data Governance

Core Experience:
10+Years as Business Analyst (Finance)
Finance and Banking BA experience
Contact me with questions:
Jamie Rosado
jrosado@astoncarter.com
212.548.6248

About Aston Carter:
At Aston Carter, we’re dedicated to expanding career opportunities for the skilled professionals who power our business. Our success is driven by the talented, motivated people who join our team across a range of positions – from recruiting, sales and delivery to corporate roles. As part of our team, employees have the opportunity for long-term career success, where hard work is rewarded and the potential for growth is limitless.

Established in 1997, Aston Carter is a leading staffing and consulting firm, providing high-caliber talent and premium services to more than 7,000 companies across North America. Spanning four continents and more than 200 offices, we extend our clients’ capabilities by seeking solvers and delivering solutions to address today’s workforce challenges. For organizations looking for innovative solutions shaped by critical-thinking professionals, visit AstonCarter.com. Aston Carter is a company within Allegis Group, a global leader in talent solutions.

The company is an equal opportunity employer and will consider all applications without regards to race, sex, age, color, religion, national origin, veteran status, disability, sexual orientation, gender identity, genetic information or any characteristic protected by law.

If you would like to request a reasonable accommodation, such as the modification or adjustment of the job application process or interviewing process due to a disability, please call 888-237-6835 or email astoncarteraccommodation@astoncarter.com for other accommodation options. However, if you have questions about this position, please contact the Recruiter located at the bottom of the job posting. The Recruiter is the sole point of contact for questions about this position.",,,
26,2022-01-24,glassdoor,data analyst,1.0,Data Analyst,false,true,WebMD,30d+,1001 to 5000 Employees,2005,Company - Public,Internet,Information Technology,$500 million to $1 billion (USD),3.3,127 Ratings,60 %,60 %,Data Analyst,"New York, NY","Medscape, a division of WebMD, develops and hosts physician portals and related mobile applications that make it easier for physicians and healthcare professionals to access clinical reference sources, stay abreast of the latest clinical information, learn about new treatment options, earn continuing medical education credits and communicate with peers.

WebMD is an Equal Opportunity/Affirmative Action employer and does not discriminate on the basis of race, ancestry, color, religion, sex, gender, age, marital status, sexual orientation, gender identity, national origin, medical condition, disability, veterans status, or any other basis protected by law.

Data Analyst – Medscape Education

Medscape, a division of WebMD, is currently seeking a Data Analyst for our Education business unit. Medscape develops and hosts a physician portal and related mobile applications that make it easier for physician and healthcare professionals to access clinical reference sources, stay abreast of the latest clinical information, learn about new treatment options, as well as earn continuing medical education credits and communicate with peers.

Do you love data and creating processes and automations that make a difference for the business and improving healthcare? Are you strong in data management, analytical, communication, and problem solving? Do you like to get into the weeds with details of data and processes? If your answers to these questions are yes, you may be the perfect candidate for the Data Analyst role for our Education business unit. You must have a proven ability to meet deadlines, while being proactive, detail-oriented and identifying opportunities for automation and process improvement.

The Data Analyst reports to a Sr Data Analyst, for Medscape’s Education business and will be responsible for analysis and reporting of online education initiatives targeting Medscape’s physicians and healthcare professional members. In addition, this role will provide various Web Traffic and Membership analysis, actionable insights and the evolution and management of various KPIs. The Data Analyst will be responsible for developing dashboards and automated processes in order to collect, mine and report on this data. The role will have cross-functional and cross-divisional responsibilities to provide various stakeholders, including Sales, Audience Engagement, Outcomes, Marketing, Product and CME Compliance teams, with results-oriented data and performance metrics.

Specific Responsibilities:

Devise methodologies for and perform analysis on web traffic, membership behavior, and product performance.
Understand our online transactional processing systems, enterprise data warehouse, and data models
Work with business stakeholders to verify and release new reporting products and manage the review and investigation of defects
Further develop Medscape’s proprietary data reporting tools and processes to ensure the short- and long-term needs are met
Analyze activity data, provide assessments of trends, and position activity metrics to meet external objectives
Provide data and dashboard support for externally-facing metrics reports measuring overall educational activity performance and impact
Work with internal Medscape teams to improve database logic for internal tools and improve reporting capabilities.

Requirements:

Education: Bachelor’s Degree or equivalent experience; a concentration in Econometrics, Information Systems, Computer Science or scientific, mathematical or data intensive field of study is highly preferred.
Minimum of 3-5 years of related work experience
Experience in data modeling, data warehouses, and business intelligence platforms.
Must be proficient in SQL with the ability to write complex queries against an enterprise data warehouse to summarize and provide analytics and insights
Proficient in Python with the ability to use it for scripting and analysis/statistical modeling.
Experience with tools used for data processing such as Linux, Shell, Cron, etc.
Have an understanding in Data Science methodology and techniques. Experience in Data Science is a big plus but not required.
Experience with industry recognized business intelligence/data visualization tool(s) such as Tableau (or Microstrategy, Looker, Power BI, SAP Business Object, Domo, and Qlik,).
Ability to balance long-term strategic planning with tactical analytical & reporting requests
Strong analytical skills combined with proficiency in understanding, representing, and communicating data-driven analysis to various departments by taking data and telling a story
Creative thinker who can utilize existing resources in a productive and/or innovative way","$65,598 /yr (est.)",$46K ,$93K
