,date,jobsource,jobsearch,MetroID,jobtitlenorm,jobeasyapply,jobisorganic,companyname,jobdaysago,companysize,companyfounded,companytype,companyindustry,companysector,companyrevenue,companyrating,companyratings,companyrecommendfriend,companyapproveceo,jobtitle,cityname,jobdescription,wageavg,wagemin,wagemax
10,2022-01-24,glassdoor,data analyst,1.0,Operations Analyst,true,false,Marathon Energy Corporation,13d,,,,,,,,,,,Operations Analyst,"Woodside, NY","About Marathon
Marathon is a rapidly growing energy supplier that provides a broad range of energy products and services to customers in
NY, NJ, PA and MD. Please visit our website for more information: https://mecny.com/
Marathon is an equal opportunity employer, and applicants considered will not be because of age, color, disability, gender, national origin, race, religion, sexual orientation, gender identity, protected veteran status, or any other classification protected by federal, state, or local law.
Job Summary
Marathon Energy is seeking a positive, goal-oriented Operations Analyst. The Operations Analsyt position has been structured to enable employee growth by providing exposure across all Operations functions, including enrollments, billing, sales support, collections and customer service. Attention to detail, ability to work in a fast-paced environment, organizational skills and ability to organize and analyze data are necessary skills to succeed within this role. Multi-tasking is a must! Company offers a competitive salary based on experience, benefits, and 401K plan.
Job Description:
Perform a variety of analytical functions including the review and management of large data sets to ensure customer billing accuracy and compliance with internal controls
Analyze customer contracts and execute accurate set up of billing rules within billing system(s)
Lead and assist with continuous process improvement projects related to billing controls, quality & efficiency, and automation opportunities
Research and resolve complex billing issues utilizing analytical and reporting tools as well as collaborating with cross functional peers
Ensure accurate and timely processing of all customer invoices
Review accounts receivable aging reports and contact customers (via phone, email, and letter) for payment
Work closely with Marathon sales agents for assistance with customer collections
Contact customers with Early Termination Fees regarding re-enrollment or for payment
Work with collection attorneys in each state we serve as needed
Report on collections activities to the Director, Credit and Collections and the Corporate Controller
Field incoming calls/customer inquiries from current customers and prospects
Record the call and distribute to the Managing Agent while assisting in resolving the ticket within outlined timeframes
Perform customer service responsibilities to maintain superior level of customer satisfaction
Make outbound calls to targeted groups to acquire new customers and retain existing ones
Assist the Sales team in gathering necessary data and reporting needed to facilitate sales to current and prospective customers
Assist the Sales team in quoting and contracting with current and prospective customers
Work in the Sales Support inbox and ensure responses are provided in a timely fashion
Assist in running and distributing various sales reporting
We are seeking candidates who meet the following criteria:
Bachelor’s degree
1-3 years work experience required
1-3 years experience with a retail energy company preferred
Proficiency in Microsoft Office and Excel required
Strong organization skills are required, with demonstrated ability to effectively handle multiple projects and tasks, and deliver work product on time
Eagerness to contribute in a team-oriented environment
Ability to work creatively and analytically in a problem-solving environment
Not afraid to ask questions and strong communication and interpersonal skills
Must be able to work remotely on a temporary basis
Must be able to commute to Woodside, NY or Syracuse, NY office
Must be fully vaccinated for COVID
Job Type: Full-time
Benefits:
401(k)
401(k) matching
Dental insurance
Health insurance
Life insurance
Paid time off
Vision insurance
Schedule:
8 hour shift
Supplemental Pay:
Bonus pay
Education:
Bachelor's (Preferred)
Experience:
Microsoft Office: 1 year (Required)
Work Location: Multiple Locations",,,
11,2022-01-24,glassdoor,data analyst,1.0,Financial Analyst,true,false,HighTower Advisors,26d,501 to 1000 Employees,2008,Company - Private,Investment Banking & Asset Management,Finance,Unknown / Non-Applicable,3.3,14 Ratings,50 %,100 %,"Financial Analyst, Data and Reporting - Nucleus Advisors","New York, NY","Nucleus’s Mission/Vision

Nucleus Advisors is a highly seasoned transformational, multi-generational, multi-cultural Wealth Advisory firm with a mission to inspire and unleash Next Generation Leaders.

We have been supporting our artists, athletes, and advocates in unique ways. We have done so with a mindset and orientation for Withness®.

Our vision is to locate, inspire, and unleash the world’s NexGen artists, athletes, and advocates—each in their own unique ways—as we share our wisdom with the world.

The Nucleus Advisors’ 3.0 mission/vision is pointing us toward using digital technology to share our wisdom with all the North and South American talented creatives we can reach—inspiring and coaching them to pay attention to the tensions that may hold them back from creating a lasting legacy and making the greatest difference possible with the communities and small groups they love.

What follows is what we believe makes us, us as people, in no particular order: Connection, Depth, Curiosity, Direction and Withness®.

Location: Remote, Infrequent Travel to Boca Raton and NYC

POSITION SUMMARY

The Data Management and Reporting Analyst plays a crucial role at Nucleus and is central to executing our growth strategy. The role reports to the Senior Director of Finance and Operations.

The Analyst will be a proven and collaborative teammate and will support Nucleus as we develop new and enhance current internal and client-facing portfolio reporting capabilities, to ensure Nucleus remains on the path to preeminence in the wealth advisory industry.

Primary Purpose
Collect, consolidate, and present data tracking transactions and valuation updates for alternative investments (hedge funds, private equity funds, other limited partnerships)
Integrate alternative investment fund data with Nucleus’ portfolio reporting platform and internal dashboards
Perform regular quality checks to ensure alternative investment transactions and performance data is accurate, complete, reliable, and timely
Identify and resolve data discrepancies
Develop relationships and work closely with alternative investment fund managers and administrators, and Hightower’s client reporting support team to ensure an accurate and streamlined reporting process
Create and document policies and procedures for data management, data integrity and quality assurance
Coordinate with Hightower’s Field Supervision team to ensure Nucleus remains compliant with data retention and private asset valuation policies
Oversee control related tasks across the various reporting functions to ensure a single cohesive approach to reporting and audit protocols
Help evaluate and integrate new processes and technology solutions to improve efficiencies in Nucleus’ client reporting
Develop an understanding of traditional and alternative investments and multi-asset class portfolios
Work closely with Nucleus’ Financial Analysts to prepare monthly client portfolio reports
Assist with ad-hoc client reporting requests and projects
There will be opportunities to work with all members of the team and learn about asset allocation, portfolio management, alternative investments, and trust and estate, insurance, tax, financial and philanthropic planning.

The candidate is thorough in their work, operates with a high attention to detail, has strong analytical, EQ, communication, interpersonal, organization, time management and problem-solving skills, and is driven to develop and grow in their role.

Nucleus Advisors is dually located in NYC and Boca Raton, Florida. Our firm has embraced a flexible remote work policy, however those teammates not locally based will be asked to travel to Boca Raton and NYC occasionally throughout the year for team events and workshops.

What You’ll Bring
Strong quantitative and financial acumen
Exceptional attention to detail
Comfort and expertise with analyzing large data sets
Methodical, thorough, and efficient in completing projects
Ability to identify patterns in the data and effectively present and convey complex topics in an easy-to-understand manner
Can effectively balance multiple simultaneous priorities and deadlines with tight timelines
Interest in gaining knowledge about wealth management, portfolio allocation and alternative investments
Initiating projects and asking, “How can I help?”
Perseverance and resourcefulness in problem solving
Desire to collaborate in small groups, move toward open dialogue and be surrounded by people equally inspired by learning
Comfort with and desire to give and receive feedback
Ability to foster relationships with teammates, clients, and third-party vendors
Professionalism
EQ, Attunement, and Empathy
Education and Experience

Undergraduate degree required (provide GPA)
Degree in finance, accounting, statistics, engineering, or information technology, is preferred
4+ years of professional experience

Paid Time Off
Entitled to earn up to 15 days of paid vacation and 5 /personal/sick days per year, accruing monthly and pro-rated for partial years of employment
Entitled to 2 Withness® Holidays per year—in addition to vacation and personal days—to take for any reason one chooses so she or he can be with someone on some special day or just to go to the beach or a park and enjoy the day.
Nucleus also offers 2 Summer Fridays Off per year
Nucleus also observes the NYSE Holiday Schedule (https://nyse.com/markets/hours-calendars)","$85,423 /yr (est.)",$57K ,$129K
12,2022-01-24,glassdoor,data analyst,1.0,Data Analyst,true,false,Ursus,3d,51 to 200 Employees,2015,Company - Private,IT Services,Information Technology,$25 to $50 million (USD),4.2,18 Ratings,80 %,85 %,Data Analyst - Business Products,"New York, NY","Job Title: Data Analyst - Business Products
Location: New York, NY
Duration: 1 Year

Summary:
This candidate will be working on Business Products Engineering- Developing reporting tier 1- 2 Tableau with PSO operational reporting and insights for new products.

Job Responsibilities:
Test programs or databases, correct errors and make necessary modifications.
Modify existing databases and database management systems or direct programmers and analysts to make changes.
Write and code logical and physical database descriptions and specify identifiers of database to management system or direct others in coding descriptions.
Skills:
2-5 years experience in the following:
Tableau
Development skills
Data analysis skills - sequel
Problem solving skills
Education/Experience:
Associate's degree in computer programming or equivalent training required.

IND123","$88,412 /yr (est.)",$64K ,$121K
13,2022-01-24,glassdoor,data analyst,1.0,Vice President Business Analysis,false,false,Citi,1d,10000+ Employees,1812,Company - Public,Investment Banking & Asset Management,Finance,$10+ billion (USD),3.9,1618 Ratings,76 %,90 %,"Compliance Business Analyst, VP - Tech & Data","New York, NY","Citi’s Compliance Technology & Data team is looking for an experienced, motivated and self-driven business analyst to join our team.
Our team is responsible for enabling compliance technology solutions, ensuring a seamless user experience, enhanced data quality, and simple solutions. We are the intermediaries between the system’s end-users and the technology development team, playing a critical role in helping to understand business requirements and translating them into simple, feasible solutions.
We are a fast-growing team, and you will be joining at the start of Compliance’s Transformation to establish a culture of innovation and design thinking. You will also get exposure to Agile methodology, gain in-depth knowledge of Citi’s systems and compliance frameworks, and have the opportunity to work with senior stakeholders and compliance SMEs to design and implement new and/or enhanced system solutions.
The ideal candidate to join our team will have business analyst experience in financial services or consulting; prior experience working in a compliance or risk-related function is desirable, but not required. To be successful in this role, curiosity is a must! We are passionate about exploring systems, questioning requirements and data, and bringing the team together to drive the best solutions.
If your skillset is not an exact match but you are interested in joining Citi and being a part of our transformation journey, we encourage you to apply! We are hiring for a broad range of positions, and we need talented and passionate people with diverse backgrounds and experiences to help us transform the way we work.

Key Responsibilities:
Work with cross functional teams to design and build best-in-class systems and tools architecture that enable effective management of compliance risks and analytics-driven insights, leveraging agile to meet the transformation goals
Run workshops with business stakeholders to capture business processes and requirements
Analyze business processes and translate them into documented user stories / functional requirements
Give meaning to data by analyzing data sources and transforming it into meaningful information and insights
Prepare and review documentation for firm-wide use (including communications, training, user guides, etc)
Qualifications:
5-7 years’ relevant experience in the financial industry or related technology or business analytics role for risk and control functions
Experience in technology implementations, including requirements management, business analysis and user acceptance testing.
Must be a self-starter, flexible, innovative and adaptive, able to navigate a complex organization
Strong interpersonal skills with the ability to work collaboratively and with people at all levels of seniority
Comfortable working with multiple data sources and transforming into meaningful insights
Strong written and verbal communication skills
Project management and organizational skills and capability to handle multiple projects at one time
Proficient in MS Office applications (Excel, Word, PowerPoint, MS Project)
Experience with Agile, database or visualization tools a plus
Education:
Bachelor’s degree; Advanced degree a plus
-
Job Family Group:
Compliance and Control
-
Job Family:
Compliance Risk Management
-
Time Type:
-
Citi is an equal opportunity and affirmative action employer.
Qualified applicants will receive consideration without regard to their race, color, religion, sex, sexual orientation, gender identity, national origin, disability, or status as a protected veteran.
Citigroup Inc. and its subsidiaries (""Citi”) invite all qualified interested applicants to apply for career opportunities. If you are a person with a disability and need a reasonable accommodation to use our search tools and/or apply for a career opportunity review Accessibility at Citi.
View the ""EEO is the Law"" poster. View the EEO is the Law Supplement.
View the EEO Policy Statement.
View the Pay Transparency Posting
-
Effective November 1, 2021, Citi requires that all successful applicants for positions located in the United States or Puerto Rico be fully vaccinated against COVID-19 as a condition of employment and provide proof of such vaccination prior to commencement of employment.","$99,362 /yr (est.)",$68K ,$145K
14,2022-01-24,glassdoor,data analyst,1.0,BI Analyst,true,false,Jellysmack,30d+,501 to 1000 Employees,2016,Company - Private,Internet,Information Technology,Unknown / Non-Applicable,4.2,45 Ratings,82 %,89 %,BI Analyst / Data Analytics Engineer,"New York, NY","Jellysmack is the global creator company that detects and develops the world's most talented video creators on social media. We're an optimistic crew who naturally goes the extra mile, has a glass-half-full mindset, and sees challenges as opportunities. We look for positive people who think outside the box, are inventive, bold, lead change, and believe that teamwork matters.
The Team Culture
Our job is to take numbers and turn them into reasons to celebrate! Data drives everything we do at Jellysmack and is thus essential to the company. Data is at the heart of our success, and it drives the content we create and how we edit videos so we can optimize everything we publish. Everyone on our team is capable of going above and beyond the call of duty. Our goal is to gather and analyze data to help the company grow. Do you have what it takes to be part of our team?
The Role
The BI Analyst / Data Analytics Engineer will be part of a team of 10+ analysts and be in charge of modeling raw data into datasets that enable analytics across the company, making sure those datasets are updated, tested, and documented.
Working closely with Data Engineers and Data Analysts, and this person will be responsible for performing a range of duties that supports both of those roles.
The Responsibilities
Organizing and transforming the data in a meaningful way and providing additional context as necessary so that it is easily accessible and ready for analysis
Working closely with Data Engineers to build and schedule ETL or ELT pipelines in production and streamline processes
Collaborating with DBA to create and maintain complex databases
Writing production-quality ELT code with an eye for performance and sustainability
Collaborating on infrastructure projects and emphasizing the business value of applications
Developing and designing analytics projects as necessary
Training other members of the organization so that they’re capable of using various data tools and communicating with other members of the team
Jellysmack’s technical Stack
Languages : Python, SQL
Databases : Aurora, Redshift, ElasticSearch on AWS
Librairies : Pandas, numpy, SQLAlchemy,...
Visualisation tools : PowerBI, plotly
Environment : We use Pycharm / VSCode and Jupyter but we’re open to anything!
Requirements
A Little About You
You have a Master’s degree or Bachelor’s degree in Computer Science or related fields, with a minimum 2 years of experience in a similar role
You are an expert in SQL (MySQL) - query optimization is second nature, and you know how to write SQL that is easy to understand and troubleshoot and performs well
You have strong skills in SQL and Python, software engineering, data warehousing, data extraction, and data modeling
You are experienced in developing data pipelines and using version control systems
You have solid experience in time and task management
You possess good written and verbal communication skills, including the ability to effectively collaborate with multidisciplinary groups and all organizational levels.
You are luefluentncy in at least two of the following languages : English, Kosovar, French, Corsican, or Python. (We do have teams and analysts that can speak all of them!)
Benefits
The Location
Jellysmack believes in a flexible work environment in which anyone can work from anywhere. This is why we’ve implemented our flexible location philosophy, meaning you get the best of both worlds: you can choose to work from home and /or from our offices in Paris, New York, Los Angeles and Corti.
In order to make sure you get the best working environment, you will get a $300 / EUR 250 allowance to get set up!
The Perks
Early Summer release Fridays
Paid volunteering: 1 day dedicated to supporting a cause of your choice
Company sponsored wellness programs and events
Competitive Healthcare coverage
401K match
WeWork Global Access
The Difference
Our commitment to diversity and inclusion at Jellysmack, we believe that the best ideas come from the diverse cultures of our team members. Our commitment to inclusion across race, gender, age, religion, identity, and experience drives us forward every day. Creating a work culture that is safe and comfortable for our people to flourish is our main focus.
The Company
Jellysmack’s story started in 2016, and since then, our unrivaled platform optimizes and distributes video content across social media platforms and allows creators to reach genuine new fans with zero effort. We are the only company building the hyper-engaged communities that every creator dreams of because, first and foremost, we are creators too.
Creatives ourselves, we’re home to over 250 influential creators, including Derek Deso, Karina Garcia, Brad Mondo, MrBeast, Bailey Sarian, Patrick Starrr, and PewDiePie. Jellysmack optimizes, operates, and distributes creator-made video content to Facebook, Instagram, Snapchat, TikTok, Twitter, and YouTube. The company’s creator strategy builds upon its success in scaling its own original content channels in beauty (Beauty Studio), soccer (Oh My Goal), gaming (Gamology), and more.
Through the power of our data, we maximize reach and revenue so our creators stay focused on their passion—creating the best content for their global fan bases. We turn that passion into a brand and that brand into an empire.
Ready to be part of a great human adventure? We’re dedicated to making the best working environment possible for our people. All you have to do is apply; we are ready to let you show off your talent!","$95,264 /yr (est.)",$70K ,$129K
