,date,jobsource,jobsearch,MetroID,jobtitlenorm,jobeasyapply,jobisorganic,companyname,jobdaysago,companysize,companyfounded,companytype,companyindustry,companysector,companyrevenue,companyrating,companyratings,companyrecommendfriend,companyapproveceo,jobtitle,cityname,jobdescription,wageavg,wagemin,wagemax
4,2022-01-24,glassdoor,data analyst,1.0,Data Analyst,false,false,KIND,19d,Unknown,Company - Public,Unknown / Non-Applicable,,,,,,,,Master Data Analyst,"New York, NY","Job Description:

Who are we?
Since 2004, KIND has been on a mission to create a kinder and healthier world - one snack and one act at a time. Its iconic KIND© bars - made with real, recognizable ingredients - sparked the growth of an entirely new healthy snacking category. Today, KIND has a family of more than 80 snacks that offer solutions for a variety of occasions. All of KIND's products lead with a nutrient-dense first ingredient - whole nuts, whole grains or whole fruit - and do not contain genetically engineered ingredients, sugar alcohols or artificial sweeteners.
Inspired by the belief that acts of kindness can be a transformative force for good, both the KIND brand and The KIND Foundation seek to inspire kindness and empathy.
We're looking for passionate collaborators to help us become the foremost leader in health & wellness and positively impact society along the way. If you're looking to be a part of an inspiring, energetic and entrepreneurial environment, you’ve found the right place. And this is how you'll do it...
What you’ll do
As the Master Data Analyst, you will be responsible for the acquisition, maintenance and stewardship of all KIND master data driving our ERP system (JD Edwards) and dependent systems.
You will work closely with the Manager, MDM Technology to drive continuous improvement in master data process while maintaining close relationships with Sales, Finance, Supply Chain, New Product Development, and other IT functions to define data needs, build sustainable acquisition processes and validate data is fit for purpose on an ongoing basis. You manage GDSN data syndication to ensure KIND customers have the most accurate data to enable smooth product movement through the supply chain. And this is how you'll do it...
System Master Data
Create, maintain, and deprecate item, customer, vendor, facility, pricing, Bill of Material data in JD Edwards to facilitate smooth and accurate transaction flow through the ERP
Define and publish data definitions for organization as data elements are added or modified
Support Manager, MDM Technology in new system onboarding with standard master data process
Data Governance
Establish, document and monitor data quality standards across
Partner with Manager to identify KPIs and make recommendations to improve and maintain data quality
Develop and manage clear item and customer lifecycle process
Manage GDSN data platform and syndication process
Support transition to Salsify GDSN platform
Workflow Management
Support Manager in MDM tool design, rollout, and management to create sustainable automated workflows
Provide daily support and guidance on data acquisition and modification cross functional workflows
What you’ll bring to KIND
Consistency and stability in data structures
Ownership mindset and ability to drive the conversation as an SME
Customer Service mentality with other departments and data consumers
You are…
Incredibly organized and process driven
Detail oriented
Never satisfied with the status quo
Genuine in your desire to help make the world a kinder place, committing to always spreading and celebrating kindness

Required Experience:

You have…
2+ years experience in a Master Data role, CPG preferred
BA in Business or IT related field
Demonstrated experience in data analysis & validation
Problem solving and good communication skills
2+ year using a GDSN platform preferred
Strong Excel and data manipulation skills
Pluses
Prior experience with Salsify
Exposure to MDM tool implementation
JD Edwards knowledge
SQL
What KIND offers
Competitive salary, including a target bonus and an impressive benefits package!
Flexible Paid Time Off. Choose what works best for you, including summer hours
Excellent health, dental & vision insurance, with options to fit you & your family’s needs
Your health is important! Our wellness strategy focuses on mental and physical well-being through in office programs like Drs, Nutritionists, Mindfulness, Chair Massages & others
Casual office dress code - feel free to wear your KIND gear
Stock up on your favorite KIND bars to share with your family & friends, through a quarterly voucher
Training & tuition reimbursement program, because continuing to learn matters and we support your development
A dynamic, ambitious, fun and KIND work environment
The opportunity and responsibility to be KIND everyday
EEO
At KIND, we are committed to an inclusive workplace where diversity in all its forms is championed. KIND is proud to be an equal opportunity workplace and we are an affirmative action employer. We are committed to equal employment opportunity regardless of race, color, ancestry, religion, sex, national origin, sexual orientation, age, citizenship, marital status, disability, gender identity or Veteran status. We also consider qualified applicants with criminal histories, consistent with legal requirements. If you require special accommodation, please let us know.
#LI-LK1
From: KIND","$74,121 /yr (est.)",$51K ,$108K
5,2022-01-24,glassdoor,data analyst,1.0,Acquisitions Editor,true,false,FE International,12d,1 to 50 Employees,2010,Company - Private,Investment Banking & Asset Management,Finance,$100 to $500 million (USD),4.1,0 Ratings,81 %,N/A,M&A Analyst - Assessment Days January and February 2022,"New York, NY","About Us:
FE International is an award-winning global M&A advisor of SaaS, e-commerce and content businesses. It has completed acquisitions for thousands of founders, owners and acquirers, and is the preeminent valuation thought leader in the industry. Its team includes experts in exit planning, valuation, accounting, legal and more.
Founded in 2010, FE is known for its extensive network of pre-qualified international investors. With headquarters in New York and regional offices in Miami, San Francisco and London, FE is an international company serving clients worldwide. It was named one of The Americas' Fastest Growing Companies in 2021 and 2020 by The Financial Times and is also a three-time Inc. 5000 company.
The Opportunity:
FE International is hosting analyst assessment days over the course of January and February 2022 . We are looking to hire analysts in 3 key business areas: Lead Origination, Valuations, Financial Due Diligence and Advisory.
As an analyst at FE International, you will develop a strong foundation of business acumen, technical skills, and knowledge about the internet industry.
The interview process for all analyst roles entails:
1. Online Assessment including Verbal, Numeracy, and Personality exams.
2. Telephone Interview (if the required minimum assessment score is met, you will be forwarded to the recruitment team to find out more about yourself and answer some competency-based questions).
3. Assessment Day / In-person Interviews (if you successfully pass all stages of the assessment day, you will be asked to interview with several senior team members).
General Responsibilities:
Work closely with potential clients to collate and organize business financial data;
Provide evaluation and analysis of businesses to influence outcomes and decisions;
Research, gather, and analyze data to determine the appropriate qualification of leads;
Identify industry-specific trends and issues, including financial information, incoming profiles of prospects, and competitor performance;
Communicate and prepare materials to support recommendations to team and stakeholders; and
Assist senior staff in various departments with ad hoc requests as needed.
Required Skills:
Ability to analyze financial statements and communicate insight, patterns, and trends;
Knowledge of or have an ability to learn financial analysis, valuation, and modeling, including scenario analysis of critical assumptions;
Strong communication skills (written and verbal);
Ability to interact and build relationships with clients and across internal stakeholders;
Resourceful self-starter, able to work under pressure and manage time effectively;
Deadline-driven, with a sense of urgency;
Ability to work independently or amongst a team; and
Ability to multi-task on a variety of projects simultaneously.
Experience and Education:
Minimum of 1 year of full-time work experience.
Bachelor's degree in business administration, finance, economics, math, accounting, or equivalent.
Experience in similar roles in software, e-commerce, or technology M&A is preferred but not required; and
Working towards ACA/ACCA/CIMA/CFA or equivalent industry certifications preferred.
**Candidates must be authorized to work in the United States without sponsorship being required**
Job Type: Full-time
Schedule:
10 hour shift
Work Location: One location","Size
1 to 50 Employees
Founded
2010
Type
Company - Private
Industry
Investment Banking & Asset Management
Sector
Finance
Revenue
$100 to $500 million (USD)",,
6,2022-01-24,glassdoor,data analyst,1.0,Data Analyst,false,false,Bloomberg,30d+,10000+ Employees,1981,Company - Private,Computer Hardware & Software,Information Technology,Unknown / Non-Applicable,4.1,1919 Ratings,80 %,87 %,Data Quality Analyst - Enterprise Data,"New York, NY","We""re Bloomberg Enterprise Data - fast paced, innovative and rapidly growing. We partner closely with our clients, taking time to understand their unique businesses and individual data and technology needs. Our endless selection of datasets, covering all asset types, with multiple delivery technologies and flexible scheduling mean our clients are able to get exactly the data they need, when they need it, in the format they prefer. Without us, they simply can""t operate. Firms that contribute to applying only highest-quality data can eliminate the data inconsistencies inherent to working with multiple vendors and lower their costs overall. A partnership with Bloomberg Enterprise Data allows just this, giving them strategic advantage.

What's the Role?

The business is looking for a Data Quality Analyst to join the Enterprise Data Quality Assurance team. The successful candidate will be responsible for creating and maintaining testing frameworks that automate test plans used to ensure that Enterprise Data products are of high quality before launch.

The Quality Assurance team works with Product/Business teams and Engineering to accomplish the following:
Creating testing strategies - Identify the test scope and objective with focus for launch of new enterprise data product or dataset
Presenting test results - Able to articulate and discuss data quality issue and remediation with multiple stakeholders
Driving continuous improvements of testing tools and processes - Open-minded to new insights/technologies on how to perform testing in more reliable and efficient way
Researching solutions to address client needs - Able to research/learn independently and provide possible solutions

We""ll trust you to:
Work closely with product managers, and engineering team to ensure the highest quality of products that we offer by implementing and performing dynamic data quality assurance procedures
Have strong attention to details and dedication to efficiently work problems to resolution
Apply judgment, and collaboration skills to interact positively and communicate appropriately with team members, management and other stakeholders
Be able to prioritize and ensure projects complete on time
Produce high quality documentation of test execution
Possess the ability to quickly learn new concepts

You""ll need to have:
A strong understanding of financial data
Experience with tools to handle large scale datasets and perform statistical analysis
Proficiency in one of the programming languages such as Python, R or SQL and familiar with distributed computing frameworks (e.g., Spark)
Highly motivated individual with excellent communication skills
Strong problem solving and troubleshooting skills
Meticulous with proven analytic skills
The ability to address multiple priorities in a very fast-paced environment

Apply if you think we're a good match, and we'll get in touch with you to let you know next steps.

We are an equal opportunity employer and value diversity at our company. We do not discriminate on the basis of race, religion, colour, national origin, gender, sexual orientation, age, marital status, veteran status, or disability status.","$105,679 /yr (est.)",$74K ,$152K
7,2022-01-24,glassdoor,data analyst,1.0,Data Analyst,false,false,Guidehouse,1d,5001 to 10000 Employees,2018,Company - Private,Consulting,Business Services,Unknown / Non-Applicable,3.7,288 Ratings,68 %,82 %,"Data Analyst- Consultant - Energy, Sustainability and Infrastructure,","New York, NY","Overview

Guidehouse is a leading global provider of consulting services to the public and commercial markets with broad capabilities in management, technology, and risk consulting. We help clients address their toughest challenges and navigate significant regulatory pressures with a focus on transformational change, business resiliency, and technology-driven innovation. Across a range of advisory, consulting, outsourcing, and digital services, we create scalable, innovative solutions that prepare our clients for future growth and success. The company has more than 10,000 professionals in over 50 locations globally. Guidehouse is a Veritas Capital portfolio company, led by seasoned professionals with proven and diverse expertise in traditional and emerging technologies, markets, and agenda-setting issues driving national and global economies. For more information, please visit: www.guidehouse.com.

Responsibilities

We seek a candidate to join our analytics team supporting Guidehouse’s Energy, Sustainability, and Infrastructure group. As a member of our team you will work with utilities and energy providers, investors and large corporations, NGOs, and the public sector to create sustainable, resilient communities and infrastructure. You will perform a wide range of analytics-related activities including forecast distributed energy resource market adoption at granular locational and temporal levels; develop models to identify market opportunities and evaluate energy efficiency, load management, renewables, EVs, and energy storage programs; advise clients regarding mobility-related strategy and operations, particularly for transportation electrification and new customer programs; develop models to inform decarbonization strategy and conduct resiliency-related analytics; inform grid modernization and enhance the operational performance of grid assets; develop load forecasting models used for resource and revenue planning and performing analytics to inform rate design; use analytics to inform client business strategy and identify process improvements.

Qualifications
Bachelor’s (or equivalent work experience) in Data Science, Economics, Statistics, Applied Mathematics, Computer Science, Operations Research, Environmental Engineering/Science, Computational Physics, or other analytics degree
Strong understanding of one or several programming languages, such as R (and R’s “Tidyverse” packages), Python, SQL, as well as analytics software/platforms such as Analytica and GIS
Outstanding problem-solving skills and critical thinking
Demonstrated proficiency with spreadsheets, databases, word processing, and slide presentation software
Excellent verbal and written communication skills; ability to simply convey complex concepts
Highly developed organizational and time-management skills
High degree of self-confidence and determination; ability to self-teach
Ability to work independently and as part of a team
Strong interest in electric mobility and decarbonization

Desired:

Academic background and/or practical experience in big data analysis, statistics, machine learning, System Dynamics, linear and nonlinear optimization, Monte Carlo analysis, risk analysis and decision theory, or consumer choice analysis
Experience in the energy industry, particularly electric mobility
Experience with web-based data viewers (PowerBI, Shiny R, and/or Spotfire)
Experience with version control, integration testing, unit testing, and regression testing

Additional Requirements

The successful candidate must not be subject to employment restrictions from a former employer (such as a non-compete) that would prevent the candidate from performing the job responsibilities as described.

Due to our contractual requirements and federal orders, including an Executive Order from the White House and an emergency regulation from the Centers for Medicare & Medicaid Services (CMS), the position for which you are applying requires that you provide proof of your vaccination status. If you are unable to receive the COVID-19 vaccine for medical reasons or because of a sincerely held religious belief, you may request an exemption from the vaccination requirement which shall be reviewed after the submission of requested documentation. If an accommodation is granted, the conditions may include weekly testing and masking. All Guidehouse employees also agree to follow any additional health and safety mitigation policies that may be required in the workplace.


Disclaimer

About Guidehouse
Guidehouse is an Equal Employment Opportunity / Affirmative Action employer. All qualified applicants will receive consideration for employment without regard to race, color, national origin, ancestry, citizenship status, military status, protected veteran status, religion, creed, physical or mental disability, medical condition, marital status, sex, sexual orientation, gender, gender identity or expression, age, genetic information, or any other basis protected by law, ordinance, or regulation.

Guidehouse will consider for employment qualified applicants with criminal histories in a manner consistent with the requirements of applicable law or ordinance including the Fair Chance Ordinance of Los Angeles and San Francisco.

If you have visited our website for information about employment opportunities, or to apply for a position, and you require an accommodation, please contact Guidehouse Recruiting at 1-571-633-1711 or via email at RecruitingAccommodation@guidehouse.com. All information you provide will be kept confidential and will be used only to the extent required to provide needed reasonable accommodation.

Guidehouse does not accept unsolicited resumes through or from search firms or staffing agencies. All unsolicited resumes will be considered the property of Guidehouse and Guidehouse will not be obligated to pay a placement fee.

Rewards and Benefits
Guidehouse offers a comprehensive, total rewards package that includes competitive compensation and a flexible benefits package that reflects our commitment to creating a diverse and supportive workplace.

Benefits include:
Medical, Rx, Dental & Vision Insurance
Personal and Family Sick Time & Company Paid Holidays
Parental Leave and Adoption Assistance
401(k) Retirement Plan
Basic Life & Supplemental Life
Health Savings Account, Dental/Vision & Dependent Care Flexible Spending Accounts
Short-Term & Long-Term Disability
Tuition Reimbursement, Personal Development & Learning Opportunities
Skills Development & Certifications
Employee Referral Program
Corporate Sponsored Events & Community Outreach
Emergency Back-Up Childcare Program
Position may be eligible for a discretionary variable incentive","$98,670 /yr (est.)",$67K ,$146K
8,2022-01-24,glassdoor,data analyst,1.0,Data Analyst,true,false,Youth Consultation Service (YCS),30d+,1001 to 5000 Employees,1918,Nonprofit Organization,Health Fundraising Organizations,Non-Profit,$50 to $100 million (USD),3.6,15 Ratings,53 %,76 %,Data Analyst,"East Orange, NJ","Youth Consultation Service (YCS) is a mission driven organization which partners with at-risk individuals with special needs from birth to adulthood to build happier, healthier, more hopeful lives within their families and communities. Since 1918, YCS has brought life-changing success to New Jersey’s most vulnerable population who have been affected by trauma or intellectual or developmental disabilities. Today, YCS is recognized as one of New Jersey’s leading non-profit providers of comprehensive behavioral health and mental health services. Join our team and you can help thousands of people reach their full potential and lead fulfilling lives.
YCS is currently seeking an HRIS Coordinator. The HRIS Coordinator is responsible for performing HRIS and other HR related duties at a professional level working closely with senior HR management. This position carries out responsibilities in related HRIS and HR processes.
DUTIES AND RESPONSIBILITIES
Provides technical support, troubleshooting, and guidance to HR system users.
Confidentially maintains employee records.
Collaborates with operations and HR staff to identify system improvements and enhancements; recommends and implements solutions.
Compiles reports for HR and leadership.
Ensures system compliance with data security and privacy requirements.
Maintains knowledge of trends and developments in HRIS technology.
Strong focus on streamlining processes from paper to electronic.
Responsible for other HR process which may include assisting with compliance audits and processing HR transactions.
Additional responsibilities as directed by supervisor(s).
REQUIREMENTS
Bachelor's degree preferred.
1-3 years experience with HRIS and HR processes.
Experience with UltiPro, Kronos or a similar HRIS system desirable.
Strong Excel skills including use of pivot tables and creation of charts.
Detail oriented and well organized.
YCS is An Equal Opportunity/Affirmative Action Employer
Job Type: Full-time
Pay: $53,000.00 - $55,000.00 per year
Dental insurance
Health insurance
Life insurance
Paid time off
Vision insurance
Schedule:
8 hour shift
Day shift
Monday to Friday
Education:
Bachelor's (Required)
Experience:
HRIS process: 1 year (Required)
HRIS Technical Support: 1 year (Required)
Strong Excel Skills: 1 year (Required)
Work Location: One location",,,
9,2022-01-24,glassdoor,data analyst,1.0,Data Analyst,false,false,1199SEIU Family of Funds,30d+,1001 to 5000 Employees,Nonprofit Organization,Health Care Services & Hospitals,Health Care,$100 to $500 million (USD),,3.5,30 Ratings,58 %,67 %,Data Analyst,"New York, NY","Responsibilities

Assist Associate Director in implementing critical software applications which include requirements gathering, testing, training, and implementation
Work with the business users to understand and develop procedures to support all the software applications in use
Conduct ongoing meetings with the business users in gathering future enhancements and implementing the changes across all software applications
Develop reports that will span all the software applications and provide a standard set of information that can be utilized in analysis, trustee reporting, and grant reporting
Serve as a Project Manager to ensure the goals and outcomes are met; work with Associate Director on procedures to preserve the data integrity of information that is entered in all software applications
Assist business units with recording outcomes in all software applications; work with Information Technology and Training and Employment Fund to develop a standard reporting tool to report accurate data for the trustees’ reports from all Funds using data from existing applications
Identify, analyze and improve existing business processes; implement improved processes and ensure procedures are followed to meet departmental goals
Provide ad-hoc reporting for information that is not reported by, or available in existing software using business intelligence tools such as Qlikview, Microsoft Access, Excel and SSRS
Develop, organize and conduct staff training, including regional staff on all software applications
Perform additional duties and projects as assigned by management

Qualifications

Bachelor’s Degree in Business Management, Computer Science or equivalent years of experience required
Minimum two (2) year job related experience; to include knowledge of project management methodology, Business analysis, database structures, SQL query generation or report writing
Strong interpersonal, written, presentation and project management skills required
Experience with using Salesforce preferred
Expert knowledge of Microsoft Word, Excel, Project, Visio, PowerPoint and Access required
Strong team player; proactive and able to follow up on multifaceted projects
Must be able to work flexible hours, including some evenings","$68,678 /yr (est.)",$52K ,$91K
